id,question
82,How long do I need to simmer the soup for the vegetables to become tender?
83,What type of steak is used in the Sous Vide Steak recipe?
83,What temperature should the sous vide bath be set to for cooking?
83,How long can I cook the steak in the sous vide bath?
83,What should I do after cooking the steak in the sous vide bath?
83,What herbs are included in the recipe ingredients for the steak?
84,What are the main ingredients needed to make the Vegan Sushi Burrito?
84,Can you explain the step-by-step process for rolling the sushi burrito?
84,Is this recipe suitable for someone following a vegan diet?
84,How difficult is it to prepare the Vegan Sushi Burrito?
84,What condiment is recommended to serve with the sushi burrito?
85,What type of cuisine does the Keto Cauliflower Pizza belong to?
85,What are the main ingredients needed for this recipe?
85,What is the first step in the cooking instructions for the pizza?
85,Is this recipe suitable for a gluten-free diet?
85,How difficult is it to prepare the Keto Cauliflower Pizza?
86,What ingredients do I need to make the Jackfruit 'Pulled Pork' Sandwiches?
86,Can I make this recipe if I follow a vegan diet?
86,How do I prepare the jackfruit for the sandwiches?
86,What should I do after sautéing the jackfruit and onions?
86,Is this recipe considered easy to make?
87,What ingredients are needed to make Shakshuka Benedict?
87,Can you tell me the steps to prepare the shakshuka base?
87,How do I poach the eggs for this recipe?
87,What type of sauce is used in Shakshuka Benedict?
87,Is this recipe suitable for vegetarians?
88,What ingredients are needed for the High-Protein Overnight Oats recipe?
88,Can you explain the steps to prepare the overnight oats?
88,Is this recipe suitable for someone following a vegetarian diet?
88,How long should I refrigerate the overnight oats before serving?
88,What toppings are suggested to add before serving the dish?
89,What are the main ingredients used to make Molecular Gastronomy Fruit Caviar?
89,Can you explain the process for creating the calcium lactate bath?
89,Is this recipe suitable for a vegan diet?
89,What level of cooking skill is required for this recipe?
89,Are there any specific fruit juices recommended for this caviar recipe?
90,What type of cuisine is the Caribbean Jerk Chicken Bowl inspired by?
90,Can you list the main ingredients needed for this recipe?
90,What is the first step in the cooking instructions?
90,How is the chicken prepared before grilling?
90,What is the overall difficulty level of making this recipe?
91,What specific steps are involved in cooking the pork belly for the Bahn Mi Tacos?
91,How do I pickle the daikon and carrots for this recipe?
91,What type of tortillas should I use for the Bahn Mi Tacos?
91,Can you explain how to assemble the tacos correctly with all the ingredients?
91,Is there a recommended way to serve or garnish the Bahn Mi Tacos?
92,What ingredients do I need to make Instant Pot Beef Pho?
92,Can you explain the cooking process for the broth in detail?
92,What type of beef slices should I use for this recipe?
92,How do I serve the assembled pho bowls?
92,Is there any specific preparation needed for the rice noodles before cooking?
93,What meats can I use besides lamb for the Mafe recipe?
93,Is there a vegetarian alternative for this peanut stew?
93,How long should I simmer the Mafe to ensure the meat is tender?
93,"Can I add extra vegetables to the Mafe, and if so, which ones?"
93,What spices are typically used in the Senegalese Mafe recipe?
94,What type of fish is recommended for the ceviche tostadas?
94,How long should I cure the fish in lime juice?
94,Can I add any additional toppings to the tostadas?
94,Are there any specific diced sizes for the vegetables in the recipe?
94,What level of cooking difficulty should I expect for this dish?
95,What type of bread is used in the Kimchi Grilled Cheese recipe?
95,Which cheese is combined with kimchi in this dish?
95,What is the cooking method for the Kimchi Grilled Cheese?
95,How should I prepare the bread before grilling?
95,Is there a specific dietary preference for the Kimchi Grilled Cheese?
96,What are the main ingredients in the Ghanaian Red Red recipe?
96,How do I prepare the tomato stew for the dish?
96,Is this recipe suitable for a vegan diet?
96,What level of cooking skill is required to make Red Red?
96,What should I serve with the Ghanaian Red Red?
97,What type of cuisine does the Kangaroo Steak with Quandong Sauce belong to?
97,What ingredients are needed to prepare the sauce for the steak?
97,Can you describe the cooking method used for the kangaroo fillet?
97,Is this recipe suitable for a specific dietary preference?
97,How difficult is it to prepare the Kangaroo Steak with Quandong Sauce?
98,What type of rice should I use for the Breakfast Congee recipe?
98,How much chicken stock is needed to cook the rice?
98,Can I substitute the century egg with another ingredient?
98,What are the steps to prepare the ginger and chicken for the congee?
98,Is this Breakfast Congee recipe suitable for beginners?
99,What type of meat is used in the Moroccan Tagine with Preserved Lemon recipe?
99,What ingredients do I need to prepare the couscous to serve with the tagine?
99,Can I use other types of meat instead of lamb for this recipe?
99,What steps should I follow to simmer the tagine with preserved lemon and olives?
99,How difficult is it to prepare the Moroccan Tagine with Preserved Lemon?
